{
    "contract": "comparison",
    "contract_version": "1.0",
    "engine": "local_mooc_audit 0.4.0",
    "executed_at": "2026-10-29T15:26:54+00:00",
    "timing": {
        "snapshot_source_s": 0.041,
        "snapshot_target_s": 0.01,
        "rules_s": 0.017,
        "compare_s": 0.01,
        "total_s": 0.077,
        "memory_peak_mb": 24
    },
    "source": {
        "id": 13,
        "shortname": "CEN_E",
        "fullname": "Cenário E — arquivos",
        "startdate": "2026-01-01 00:00",
        "enddate": "2026-12-31 23:59",
        "category": "Inscrições Abertas",
        "sections": 3,
        "modules": 4,
        "modules_by_type": {
            "forum": 1,
            "resource": 3
        },
        "overall_status": "BLOQUEADA"
    },
    "target": {
        "id": 14,
        "shortname": "CEN_E_NOVA",
        "fullname": "Cenário E — arquivos",
        "startdate": "2027-01-01 00:00",
        "enddate": "2027-12-31 23:59",
        "category": "Inscrições Abertas",
        "sections": 3,
        "modules": 5,
        "modules_by_type": {
            "forum": 2,
            "resource": 3
        },
        "overall_status": "BLOQUEADA"
    },
    "policy": {
        "version": "2027-decisoes-2026-10-28",
        "target_reoffer_year": 2027,
        "source_reoffer_year": 2026,
        "source_basis": "startdate",
        "cycle_rules": [
            "CL-05",
            "CL-06",
            "CL-07",
            "CL-08",
            "CL-14"
        ],
        "note": "Destino avaliado pela política 2027-decisoes-2026-10-28 para a reoferta 2027; origem avaliada pela mesma política no contexto da sua própria oferta (2026), para não tratar como herdado o que só mudou de ano."
    },
    "summary": {
        "source_modules": 4,
        "target_modules": 5,
        "preserved": 0,
        "modified": 3,
        "modified_relevant": 3,
        "missing_in_target": 0,
        "extra_in_target": 0,
        "ambiguous_groups": 1,
        "ambiguous_source_modules": 1,
        "duplicates_in_target": 1,
        "matches_by_confidence": {
            "alta": 3
        },
        "course_diffs_relevant": 0,
        "expected_identifier_changes": 8,
        "audit_counts": {
            "pendencia_oferta": 0,
            "novo_no_destino": 5,
            "novo_em_atividade_adicional": 0,
            "persistente": 11,
            "indeterminado": 0,
            "nao_verificavel_no_destino": 0,
            "ausente_no_destino": 0,
            "resolvido_no_destino": 0,
            "nao_aplicavel_no_destino": 0
        },
        "verdict": "REVISAR"
    },
    "matches": [
        {
            "source_cmid": 165,
            "target_cmid": 170,
            "modname": "resource",
            "source_name": "Apostila 1",
            "target_name": "Apostila 1",
            "source_section": 1,
            "target_section": 1,
            "strategy": "type_section_name",
            "confidence": "alta",
            "state": "modificada",
            "relevance": "relevante",
            "problematic": true,
            "diffs": [
                {
                    "scope": "module",
                    "field": "files",
                    "source": "/apostila1.txt",
                    "target": null,
                    "kind": "relevante",
                    "code": "file_record_missing",
                    "explanation": "O arquivo /apostila1.txt existe na origem e não está registrado no destino."
                }
            ],
            "expected_count": 2
        },
        {
            "source_cmid": 166,
            "target_cmid": 171,
            "modname": "resource",
            "source_name": "Apostila 2",
            "target_name": "Apostila 2",
            "source_section": 1,
            "target_section": 1,
            "strategy": "type_section_name",
            "confidence": "alta",
            "state": "modificada",
            "relevance": "relevante",
            "problematic": true,
            "diffs": [
                {
                    "scope": "module",
                    "field": "files",
                    "source": "/apostila2.txt",
                    "target": "/apostila2.txt",
                    "kind": "relevante",
                    "code": "file_content_missing",
                    "explanation": "O arquivo /apostila2.txt está registrado no destino, mas o conteúdo não existe no armazenamento: o estudante recebe erro ao abrir."
                }
            ],
            "expected_count": 2
        },
        {
            "source_cmid": 167,
            "target_cmid": 172,
            "modname": "resource",
            "source_name": "Apostila 3",
            "target_name": "Apostila 3",
            "source_section": 1,
            "target_section": 1,
            "strategy": "type_section_name",
            "confidence": "alta",
            "state": "modificada",
            "relevance": "relevante",
            "problematic": true,
            "diffs": [
                {
                    "scope": "module",
                    "field": "visible",
                    "source": 1,
                    "target": 0,
                    "kind": "relevante",
                    "code": "visibility_changed",
                    "explanation": "Visibilidade alterada (visible: 1 → 0)."
                },
                {
                    "scope": "module",
                    "field": "files",
                    "source": "disponível ao estudante",
                    "target": "indisponível ao estudante",
                    "kind": "relevante",
                    "code": "file_unavailable",
                    "explanation": "A atividade tem arquivos e estava disponível na origem, mas no destino está oculta (atividade ou seção): o estudante não acessa os arquivos."
                }
            ],
            "expected_count": 2
        }
    ],
    "missing_in_target": [],
    "extra_in_target": [],
    "ambiguities": [
        {
            "reason": "duplicado_no_destino",
            "modname": "forum",
            "name": "Avisos",
            "source": [
                {
                    "cmid": 164,
                    "section": 0,
                    "position": 0
                }
            ],
            "target": [
                {
                    "cmid": 168,
                    "section": 0,
                    "position": 0
                },
                {
                    "cmid": 169,
                    "section": 0,
                    "position": 1
                }
            ],
            "settings_identical": true,
            "explanation": "Uma atividade na origem e 2 com o mesmo tipo e nome no destino (duplicidade): confira qual deve permanecer; nenhuma foi escolhida automaticamente."
        }
    ],
    "course_diffs": [
        {
            "scope": "course",
            "field": "shortname",
            "source": "CEN_E",
            "target": "CEN_E_NOVA",
            "kind": "esperada",
            "code": "offer_setting",
            "explanation": "Configuração da oferta alterada (shortname: CEN_E → CEN_E_NOVA): esperado em uma nova oferta; a conformidade é verificada pela política da nova oferta."
        },
        {
            "scope": "course",
            "field": "startdate",
            "source": "01/01/2026 00:00",
            "target": "01/01/2027 00:00",
            "kind": "esperada",
            "code": "offer_setting",
            "explanation": "Configuração da oferta alterada (startdate: 01/01/2026 00:00 → 01/01/2027 00:00): esperado em uma nova oferta; a conformidade é verificada pela política da nova oferta."
        },
        {
            "scope": "course",
            "field": "enddate",
            "source": "31/12/2026 23:59",
            "target": "31/12/2027 23:59",
            "kind": "esperada",
            "code": "offer_setting",
            "explanation": "Configuração da oferta alterada (enddate: 31/12/2026 23:59 → 31/12/2027 23:59): esperado em uma nova oferta; a conformidade é verificada pela política da nova oferta."
        },
        {
            "scope": "enrol",
            "field": "self.status",
            "source": 1,
            "target": 0,
            "kind": "esperada",
            "code": "offer_setting",
            "explanation": "Configuração da oferta alterada (self.status: 1 → 0): esperado em uma nova oferta; a conformidade é verificada pela política da nova oferta."
        },
        {
            "scope": "enrol",
            "field": "self.enrolstartdate",
            "source": "(não definida)",
            "target": "01/01/2027 00:00",
            "kind": "esperada",
            "code": "offer_setting",
            "explanation": "Configuração da oferta alterada (self.enrolstartdate: (não definida) → 01/01/2027 00:00): esperado em uma nova oferta; a conformidade é verificada pela política da nova oferta."
        },
        {
            "scope": "enrol",
            "field": "self.enrolenddate",
            "source": "(não definida)",
            "target": "31/12/2027 23:59",
            "kind": "esperada",
            "code": "offer_setting",
            "explanation": "Configuração da oferta alterada (self.enrolenddate: (não definida) → 31/12/2027 23:59): esperado em uma nova oferta; a conformidade é verificada pela política da nova oferta."
        }
    ],
    "audit": {
        "items": [
            {
                "classification": "novo_no_destino",
                "rule": "CL-12",
                "title": "Livro de notas: soma 100, agregação Natural, sem excluir vazias",
                "category": "assessment_grades",
                "severity": "Alta",
                "status_source": null,
                "status_target": "NAO_CONFORME",
                "local": "Livro de notas > categoria raiz",
                "cmid_source": null,
                "cmid_target": null,